{
  "source": {
    "title": "为什么很多 AI 视频看起来像 PPT？",
    "text": "解释页面运动与真正动画的区别，用连续动作展示状态变化、因果链、镜头和节奏。"
  },
  "claims": [
    {
      "id": "problem",
      "text": "很多自动视频停留在页面切换、文字运动和装饰性转场。",
      "type": "state"
    },
    {
      "id": "motion",
      "text": "真正的动画需要可感知的状态变化。",
      "type": "definition"
    },
    {
      "id": "causal",
      "text": "动作应形成看见、接近、触碰、反应的因果链。",
      "type": "sequence"
    },
    {
      "id": "system",
      "text": "镜头、节奏和声音共同组织时间。",
      "type": "definition"
    },
    {
      "id": "thesis",
      "text": "视频不是会动的PPT，而是被时间组织的故事。",
      "type": "state"
    }
  ],
  "duration": 40,
  "output": {
    "width": 1280,
    "height": 720,
    "fps": 30
  },
  "style": {
    "background": "#F7F1E3",
    "palette": {
      "ink": "#17332E",
      "paper": "#F7F1E3",
      "cream": "#F3E5C8",
      "coral": "#E66D5A",
      "blue": "#5C93B8",
      "yellow": "#E9BE4B",
      "green": "#719A78",
      "white": "#FFFFFF",
      "muted": "#9EAAA2",
      "captionBg": "#17332E"
    }
  },
  "captionStyle": {
    "fontSize": 30,
    "fontFamily": "Noto Sans CJK SC, Noto Sans, Arial, sans-serif"
  },
  "beats": [
    {
      "id": "hook",
      "time": 0,
      "label": "hook"
    },
    {
      "id": "problem",
      "time": 5,
      "label": "problem"
    },
    {
      "id": "motion",
      "time": 11,
      "label": "motion"
    },
    {
      "id": "causal",
      "time": 18,
      "label": "causal"
    },
    {
      "id": "system",
      "time": 25,
      "label": "system"
    },
    {
      "id": "payoff",
      "time": 32,
      "label": "payoff"
    }
  ],
  "captions": [
    {
      "start": 0,
      "end": 4.8,
      "text": "为什么很多 AI 视频，看起来像 PPT？"
    },
    {
      "start": 5,
      "end": 10.8,
      "text": "因为它做了画面，却没有真正做“动作”。"
    },
    {
      "start": 11,
      "end": 17.8,
      "text": "动画的最小单位，不是画面，而是变化。"
    },
    {
      "start": 18,
      "end": 24.8,
      "text": "看见 → 接近 → 触碰 → 反应。动作必须有因果。"
    },
    {
      "start": 25,
      "end": 31.8,
      "text": "镜头、节奏、声音，一起组织观众感受到的时间。"
    },
    {
      "start": 32,
      "end": 39.5,
      "text": "视频不是会动的 PPT，而是被时间组织的故事。"
    }
  ],
  "scenes": [
    {
      "id": "hook",
      "start": 0,
      "end": 5,
      "beat": "hook",
      "purpose": "用角色被困在一张页面里的反差提出问题.",
      "semanticRefs": [
        "problem"
      ],
      "visualRule": "每个镜头都必须产生可感知的状态变化；角色、道具和空间保持连续。",
      "elements": [
        {
          "type": "rect",
          "x": 0,
          "y": 0,
          "width": 1280,
          "height": 720,
          "fill": "paper"
        },
        {
          "type": "rect",
          "x": 90,
          "y": 80,
          "width": 1100,
          "height": 540,
          "fill": "white",
          "stroke": "ink",
          "strokeWidth": 6,
          "radius": 32
        },
        {
          "type": "rect",
          "x": 145,
          "y": 145,
          "width": 990,
          "height": 72,
          "fill": "cream",
          "radius": 18
        },
        {
          "type": "text",
          "x": 195,
          "y": 195,
          "text": "AI VIDEO",
          "fontSize": 42,
          "fontWeight": 800,
          "fill": "ink",
          "fontFamily": "Noto Sans CJK SC, Noto Sans, Arial, sans-serif",
          "anchor": "start"
        },
        {
          "type": "rect",
          "x": 150,
          "y": 265,
          "width": 410,
          "height": 245,
          "fill": "blue",
          "radius": 28,
          "opacity": 0.22
        },
        {
          "type": "rect",
          "x": 660,
          "y": 265,
          "width": 410,
          "height": 245,
          "fill": "coral",
          "radius": 28,
          "opacity": 0.22
        },
        {
          "type": "character",
          "characterId": "host",
          "x": 430,
          "y": 500,
          "scale": 1.3,
          "clothes": "coral",
          "skin": "#F0C5A5",
          "hair": "ink",
          "pose": "run",
          "expression": "worried",
          "direction": 1,
          "motion": {
            "type": "bob",
            "amount": 6,
            "cycles": 2
          }
        },
        {
          "type": "line",
          "x1": 535,
          "y1": 375,
          "x2": 625,
          "y2": 375,
          "stroke": "ink",
          "strokeWidth": 7,
          "motion": {
            "type": "slide",
            "dx": -100,
            "duration": 0.45
          }
        },
        {
          "type": "text",
          "x": 645,
          "y": 425,
          "text": "WHY?",
          "fontSize": 76,
          "fontWeight": 800,
          "fill": "ink",
          "fontFamily": "Noto Sans CJK SC, Noto Sans, Arial, sans-serif",
          "anchor": "start",
          "motion": {
            "type": "pop",
            "from": 0.7,
            "to": 1,
            "duration": 0.5
          }
        }
      ],
      "keyPoses": [
        {
          "id": "p1",
          "time": 0,
          "pose": "idle",
          "note": "inside page"
        },
        {
          "id": "p2",
          "time": 2,
          "pose": "run",
          "note": "tries to move"
        },
        {
          "id": "p3",
          "time": 4,
          "pose": "react",
          "note": "hits the boundary"
        }
      ],
      "events": [
        {
          "id": "notice",
          "start": 0.5,
          "end": 1.5,
          "action": "lookAt",
          "actor": "host",
          "phase": "reaction",
          "expression": "surprised",
          "gaze": "right"
        },
        {
          "id": "run",
          "start": 1.5,
          "end": 3.2,
          "action": "run",
          "actor": "host",
          "phase": "continuous",
          "pose": "run",
          "expression": "worried",
          "gaze": "right"
        },
        {
          "id": "hit",
          "start": 3.2,
          "end": 4.3,
          "action": "react",
          "actor": "host",
          "phase": "reaction",
          "expression": "worried",
          "gaze": "right"
        },
        {
          "id": "why",
          "start": 4.3,
          "end": 5,
          "action": "point",
          "actor": "host",
          "phase": "settle",
          "pose": "point",
          "expression": "surprised",
          "gaze": "right"
        }
      ],
      "camera": {
        "type": "push",
        "fromScale": 1,
        "toScale": 1.1,
        "easing": "easeOut"
      },
      "transition": {
        "type": "cut",
        "duration": 0
      },
      "reads": [
        "用角色被困在一张页面里的反差提出问题."
      ]
    },
    {
      "id": "problem",
      "start": 5,
      "end": 11,
      "beat": "setup",
      "purpose": "把页面移动和真实动作并置比较.",
      "semanticRefs": [
        "problem"
      ],
      "visualRule": "每个镜头都必须产生可感知的状态变化；角色、道具和空间保持连续。",
      "elements": [
        {
          "type": "rect",
          "x": 0,
          "y": 0,
          "width": 1280,
          "height": 720,
          "fill": "paper"
        },
        {
          "type": "rect",
          "x": 65,
          "y": 85,
          "width": 510,
          "height": 510,
          "fill": "white",
          "stroke": "ink",
          "strokeWidth": 5,
          "radius": 28
        },
        {
          "type": "text",
          "x": 320,
          "y": 155,
          "text": "PAGE",
          "fontSize": 34,
          "fontWeight": 800,
          "fill": "muted",
          "fontFamily": "Noto Sans CJK SC, Noto Sans, Arial, sans-serif",
          "anchor": "middle"
        },
        {
          "type": "rect",
          "x": 135,
          "y": 225,
          "width": 370,
          "height": 78,
          "fill": "blue",
          "radius": 18,
          "motion": {
            "type": "travel",
            "fromX": -80,
            "toX": 80,
            "duration": 1
          }
        },
        {
          "type": "rect",
          "x": 135,
          "y": 345,
          "width": 370,
          "height": 78,
          "fill": "coral",
          "radius": 18,
          "motion": {
            "type": "travel",
            "fromX": 80,
            "toX": -80,
            "duration": 1
          }
        },
        {
          "type": "text",
          "x": 320,
          "y": 505,
          "text": "换位置 ≠ 动作",
          "fontSize": 36,
          "fontWeight": 800,
          "fill": "ink",
          "fontFamily": "Noto Sans CJK SC, Noto Sans, Arial, sans-serif",
          "anchor": "middle"
        },
        {
          "type": "rect",
          "x": 625,
          "y": 85,
          "width": 590,
          "height": 510,
          "fill": "cream",
          "stroke": "ink",
          "strokeWidth": 5,
          "radius": 28
        },
        {
          "type": "text",
          "x": 920,
          "y": 155,
          "text": "ACTION",
          "fontSize": 34,
          "fontWeight": 800,
          "fill": "ink",
          "fontFamily": "Noto Sans CJK SC, Noto Sans, Arial, sans-serif",
          "anchor": "middle"
        },
        {
          "type": "prop",
          "kind": "ball",
          "x": 830,
          "y": 430,
          "fill": "coral",
          "scale": 0.72,
          "stroke": "ink",
          "motion": {
            "type": "travel",
            "fromX": -170,
            "toX": 100
          }
        },
        {
          "type": "character",
          "characterId": "host",
          "x": 840,
          "y": 505,
          "scale": 1.22,
          "clothes": "blue",
          "skin": "#F0C5A5",
          "hair": "ink",
          "pose": "reach",
          "expression": "excited",
          "direction": 1,
          "motion": {
            "type": "bob",
            "amount": 4,
            "cycles": 1
          }
        },
        {
          "type": "line",
          "x1": 700,
          "y1": 430,
          "x2": 770,
          "y2": 430,
          "stroke": "ink",
          "strokeWidth": 5,
          "motion": {